{"admission":{"activation_path_reviewed":true,"base":"fc06902b7dd7aa1610438cd061ccf7f04b31c609","commands_reviewed":true,"default_branch":"main","human_line_review":true,"merge_commit":"b326fafe5405b9996db9c9f0d7758536148ecc9b","node_id":"R_kgDOUJjQqg","observed_at":"2026-10-12T20:28:43+08:00","observer_independence_reviewed":true,"pull_request":27,"repository":"vLLM-HUST/vllm-hust","repository_id":1352192170,"reviewed_head":"f3eb4b09ba91a1720c4e35de41a91e6dc351fd5b","reviewed_tree":"bcdb8c810b60c11e77cb8af2002bd9039600b808","schema":"ecpa-formal-adapter-admission/v1","state":"merged"},"bindings":{"candidate_sha256":"sha256:e09f10b49c8b5008763e68021ea0ca1577b40dc33e010a61070ec27fe653b2ea","producer_candidate_sha256":"sha256:62d36515a875acadb6905fb3c0affcdff1bfd6e7574296c8d84f9d773793a150","qualification_sha256":"sha256:8a8cdee6cd2729ecbaecc6bad7a5353793203fb2237e9d71700e10e659147451","review_receipt_digest":"sha256:e8e95f80a89312694f3b0fc5548f20e4de7f82161805905b1a3b27e14640a21d","review_sha256":"sha256:846307191d1d2177252c7c9206a3e842acf6a7f88d434f1b0c1441bde3497b53","review_subject_candidate_sha256":"sha256:d5f58616766cc1a480dac228e55fb11a43501dd3e4ff3e0ca6ef9df9bc3512b7","source_commits":{"accelerator_plugin":"873584026f8a683ac73523f15127569e9f6ab34b","host":"973d9ef5acd2b9beb03e399dec1511a41fc941b5","manager":"b734a923a566f3d1b07b22e087fdbab796b3b1d9","mod":"e343fc5ce6b4c64611a79df5d797b3db12cd6dac"}},"formal_h1_starts":0,"human_review_evidence":{"review_comment_id":5853006976,"reviewed_head":"f3eb4b09ba91a1720c4e35de41a91e6dc351fd5b","reviewer":"Apei-520","verdict":"APPROVE"},"machine_gates":{"activation_path_reviewed":true,"artifact_retention_reviewed":true,"candidate_machine_shape":true,"commands_reviewed":true,"observer_independence_reviewed":true,"reachable_sources":true,"source_identity_match":true,"three_arm_tp2_functional_qualification":true},"non_claims":["The deployment review is automated-independent, not human review.","The TP2 qualification runs are preflights, not formal H1 starts.","The qualification receipt is not a performance result.","This issuance does not mutate the official study, deployment, or registry."],"official_files_mutated":false,"receipt_digest":"sha256:4a2e6f8d1bdaa672df6e14ddad4e01740bf5c570cc2b481f0c15f37df010e19f","review_modes":{"deployment_checks":"automated-independent","producer_source":"existing-human-line-review","protocol_amendment":{"digest":"sha256:e52dc2b3c171fabcada7ff5dc4370b28ad758f72b2c68292430af80b4165da9c","id":"h1-review-mode-owner-amendment-2026-10-13"}},"schema":"ecpa-h1-producer-admission-issuance/v1"}
